,サービス名,企業名,説明,利用料金,初期費用,無料プラン,無料トライアル,詳細情報
0,マッチングソリューション,株式会社 Laboro.AI,"人材業界のための
「マッチングソリューション」",お問い合わせ下さい,お問い合わせ下さい,なし,なし,https://ai-products.net/product/matching/
1,AIME-Solution,AIMENEXT JAPAN 株式会社,AIMENEXTと一緒に、AIでビジネスに「新価値」を今すぐ,お問合せください,お問合せください,なし,なし,https://ai-products.net/product/aime-solution/
2,完全審査制 AIビジネスマッチング「yenta」,株式会社アトラエ,組織の枠を越えた出会いが、ビジネスを加速させる,お問い合わせ下さい,お問い合わせ下さい,あり,ー,https://ai-products.net/product/matching-yenta/
3,xTech,メタデータ株式会社,超高速多対多マッチングエンジン,お問い合わせ下さい,お問い合わせ下さい,なし,お問い合わせ下さい,https://ai-products.net/product/matching-xtech/
4,アイジェント・レコメンダー,シルバーエッグ・テクノロジー株式会社,AI技術を用いたリアルタイム・レコメンドサービス,お問い合わせ下さい,お問い合わせ下さい,お問い合わせ下さい,お問い合わせ下さい,https://ai-products.net/product2/aigentrecommender/
