,サービス名,企業名,説明,利用料金,初期費用,無料プラン,無料トライアル,詳細情報
0,hachidori LINE広告,hachidori株式会社,hachidori LINE広告,お問い合わせください,10万円,お問い合わせください,お問い合わせください,https://ai-products.net/product/hachidori-line/
1,qualva,株式会社 PROFESSY,コンバージョンチャットボットqualva（クオルバ）,月額1万円〜,5万円〜,なし,なし,https://ai-products.net/product/qualva/
2,AIME-Solution,AIMENEXT JAPAN 株式会社,AIMENEXTと一緒に、AIでビジネスに「新価値」を今すぐ,お問合せください,お問合せください,なし,なし,https://ai-products.net/product/aime-solution/
3,AIによる販促施策最適化ソリューション「AI×DM」,福博印刷株式会社,最適なDM送付対象客をAIが判定！,お問合せ下さい,お問合せ下さい,なし,あり,https://ai-products.net/product/models-solution-ai-dm/
4,A-BiSU,株式会社ユニソンプラネット,"AIによるWebマーケティング及び編集機能を
オールインワンで実現",お問い合わせ下さい,お問い合わせ下さい,なし,なし,https://ai-products.net/product/webcstool-a-bisu/
5,BOTCHAN for LP,株式会社wevnal,これまでの読ませるLPから会話するLPへ,―,―,―,―,https://ai-products.net/product/chatbot-botchan-for-lp/
6,BOTCHAN EFO,株式会社wevnal,コンバージョン率を劇的に上げる入力フォームの新常識,月額5万円～,30万円,なし,―,https://ai-products.net/product/chatbot-botchan-efo/
7,データビジネスプラットフォーム「Rtoaster」,株式会社ブレインパッド,データビジネスプラットフォーム「Rtoaster」,個別見積もり,お問い合わせ下さい,なし,なし,https://ai-products.net/product/rtoaster/
