,サービス名,企業名,説明,利用料金,初期費用,無料プラン,無料トライアル,詳細情報
0,ZIA™ Cloud SAFE,株式会社ディジタルメディアプロフェッショナル,SaaS型安全運転支援クラウドサービス「ZIA™ Cloud SAFE」,お問い合わせください,お問い合わせください,お問い合わせください,お問い合わせください,https://ai-products.net/product/zia-cloud-safe/
1,文章分類・評価ソリューション,株式会社 Laboro.AI,"自然言語処理による
「文章分類・評価ソリューション」",お問い合わせ下さい,お問い合わせ下さい,なし,なし,https://ai-products.net/product/classifying/
2,AIME-NLP,AIMENEXT JAPAN 株式会社,"「言葉の価値」を最大化する
自然言語処理「AIME-NLP」エンジン",お問い合わせ下さい,お問い合わせ下さい,なし,なし,https://ai-products.net/product/aime-nlp/
3,サプライチェーンの計画業務最適化サービス,株式会社グリッド,"サプライチェーンの計画業務最適化サービス
| 配送・配船 | 原材料・部品調達 | 生産 |",お問合せください,お問合せください,お問合せください,お問合せください,https://ai-products.net/product/optimization/
4,FLOW AI データラベリングサービス,日本FLOW株式会社,FLOW AI データラベリングサービス,お打合せ後お見積提示させていただきます。,お打合せ後お見積提示させていただきます。,なし,実データによるサンプル作成ご対応可能,https://ai-products.net/product/flow-ai/
5,Anews,ストックマーク株式会社,インサイトを共有。チームが動き出す。,お問い合わせ下さい,お問い合わせ下さい,なし,あり,https://ai-products.net/product/recommend-anews/
6,AIポジショニングマップMR.DATA,メタデータ株式会社,顧客の声やアンケートを分析,お問い合わせ下さい,お問い合わせ下さい,なし,なし,https://ai-products.net/product/ai-positioning-mr-data/
